{
  "schemaVersion": "study-a-gold-1",
  "scenarioId": "dev-parking-grace",
  "partition": "dev",
  "devExample": true,
  "confirmatory": false,
  "title": "Parking grace period",
  "domain": "municipal-parking",
  "kind": "underspecified",
  "clearControl": false,
  "naturalLanguageRequirements": "A parking stay ends when the vehicle leaves. The source text does not say whether the driver has a grace period after the paid end time.",
  "informalMarkdown": "# Functions\n\n## Close a stay\n\nThe meter closes a stay when the vehicle leaves the bay. Whether time after the paid end is forgiven is not stated.\n\n# Data Resources\n\n## Stay\n\nThe stay records the bay, the paid end time, and the departure time.\n\n# Constraints\n\n## Paid time\n\nThe driver pays for the time from arrival until the paid end time.\n",
  "unresolvedSlots": [
    {
      "id": "grace-period",
      "question": "Is there a grace period after the paid end time?",
      "alternatives": [
        { "id": "ten", "label": "A vehicle may leave within 10 minutes of the paid end time without a further charge." },
        { "id": "none", "label": "Charges continue until the vehicle leaves, and there is no grace period." }
      ],
      "authorizedAlternativeId": "ten",
      "clarificationTarget": "Whether departure after the paid end time has a grace period, and how long it is.",
      "mustNotConfirmBeforeAnswer": ["proc:Parking.CloseStay", "inv:Parking.Grace"],
      "stakeholderAnswer": "A vehicle may leave within 10 minutes of the paid end time without a further charge.",
      "matchTerms": ["grace period", "paid end"],
      "commitmentSignals": [
        { "alternativeId": "ten", "phrases": ["within 10 minutes", "10-minute grace"] },
        { "alternativeId": "none", "phrases": ["no grace period", "charges continue until the vehicle leaves"] }
      ]
    }
  ],
  "maintenance": null,
  "qualityNotes": "DEV example for harness development. No reference specification. Not part of the confirmatory freeze set."
}
