{
  "schemaVersion": "study-a-gold-1",
  "scenarioId": "dev-clinic-cancellation",
  "partition": "dev",
  "devExample": true,
  "confirmatory": false,
  "title": "Clinic late cancellation",
  "domain": "outpatient-clinic",
  "kind": "underspecified",
  "clearControl": false,
  "naturalLanguageRequirements": "A patient may cancel an outpatient visit. The source text does not say whether a cancellation inside 24 hours charges a fee.",
  "informalMarkdown": "# Functions\n\n## Cancel a visit\n\nA patient cancels an upcoming outpatient visit. Whether a cancellation inside 24 hours charges money is not stated.\n\n# Data Resources\n\n## Visit\n\nThe visit records the patient, the clinician, and the appointment time.\n\n# Constraints\n\n## Recorded cancellation\n\nA cancelled visit stays on the schedule with a cancelled status.\n",
  "unresolvedSlots": [
    {
      "id": "late-cancel-fee",
      "question": "Does a cancellation inside 24 hours charge a fee?",
      "alternatives": [
        { "id": "fee", "label": "A cancellation within 24 hours charges a late fee." },
        { "id": "nofee", "label": "A cancellation is recorded and no fee is charged." }
      ],
      "authorizedAlternativeId": "fee",
      "clarificationTarget": "Whether a cancellation inside 24 hours charges a late fee.",
      "mustNotConfirmBeforeAnswer": ["proc:Clinic.CancelVisit", "inv:Clinic.LateFee"],
      "stakeholderAnswer": "A cancellation within 24 hours charges a late fee.",
      "matchTerms": ["cancellation", "late fee"],
      "commitmentSignals": [
        { "alternativeId": "fee", "phrases": ["charges a late fee", "late cancellation fee"] },
        { "alternativeId": "nofee", "phrases": ["no fee is charged", "cancellation without a fee"] }
      ]
    }
  ],
  "maintenance": null,
  "qualityNotes": "DEV example for harness development. No reference specification. Not part of the confirmatory freeze set."
}
